{
  "bundle_schema_version": "1.3",
  "confidentiality": {
    "contains_client_data": true,
    "statement": "CONFIDENTIAL: this bundle contains client data. It belongs to the client and must not be shared like a run manifest.",
    "source_filename": "20_portfolio_mixed.csv"
  },
  "manifest": {
    "as_of_date": "2026-08-01",
    "as_of_source": "user",
    "created_at": "2026-08-30T09:00:04Z",
    "environment": {
      "app_version": "1.4.0",
      "git_commit": "16ffb72",
      "key_libraries": {
        "google-cloud-bigquery": "3.38.0"
      },
      "region": "europe-west2",
      "runtime": "python 3.12.4"
    },
    "integrity": {
      "chain_verified": true,
      "content_fingerprint_sha256": "8769bb563944e1907cbdbd7da71804934218f5f261e422a50b9d939b19a1437c",
      "manifest_sha256": "b5872449a8182e43ee0dca7d9757f02859b5e79f6271862d8e142fda1cb8c983"
    },
    "reproducibility": {
      "deterministic_stages": [
        "validation",
        "quality",
        "classification",
        "routing"
      ],
      "non_deterministic_stages": [],
      "statement": "Validation, quality, classification and routing are bitwise reproducible."
    },
    "run_id": "run_fe701b0eb24ced735e234a3091f497e5",
    "schema_version": "1.6",
    "source": {
      "bytes": 8535,
      "delimiter_detected": ",",
      "encoding_detected": "utf-8",
      "extension": ".csv",
      "filename_sha256": "d3820b4e8cc523a9400510ebefae904752f84d587285ba96e4fc2c81db4a7b01",
      "received_at": "2026-08-30T09:00:00Z",
      "rows_raw": 324,
      "sha256": "fd17fcc4f270c1810b9b5a73c0c78403874aa95cc2eb837f2f3cd63e94b284dc"
    },
    "stages": [
      {
        "completed_at": "2026-08-30T09:00:01Z",
        "duration_ms": 1000,
        "engine_version": "1.0.0",
        "input_ref": {
          "rows": 324,
          "sha256": "fd17fcc4f270c1810b9b5a73c0c78403874aa95cc2eb837f2f3cd63e94b284dc",
          "type": "source_file"
        },
        "options": {
          "aggregate_to": null,
          "analysis_level": null,
          "as_of_date": "2026-08-01",
          "column_map": {},
          "date_order": null,
          "decimal_convention": null,
          "delimiter": null,
          "encoding": null,
          "exclude_columns": [],
          "exclude_deleted": false,
          "exclude_rows": [],
          "fiscal_year_start_month": null,
          "header_row": null,
          "period_columns": null,
          "returns_in_demand": null,
          "unpivot": false,
          "year_basis": null
        },
        "outcome": {
          "blocking": 0,
          "findings": 1,
          "rows_in": 324,
          "rows_out": 324,
          "series": 12,
          "verdict": "accept"
        },
        "output_ref": {
          "rows": 324,
          "series": 12,
          "sha256": "2c3f17d545a4b6f1f32d33b9978bd3649093bec230220986fdb4416ddac6d727",
          "type": "normalised_dataset"
        },
        "passes": [
          {
            "finding_codes": [
              "LINE_ENDINGS_CRLF"
            ],
            "options_supplied": {},
            "pass": 1,
            "verdict": "accept"
          }
        ],
        "stage": "validation",
        "started_at": "2026-08-30T09:00:00Z",
        "story": "1.1",
        "transformations": [
          {
            "code": "LINE_ENDINGS_CRLF",
            "count": 1,
            "reversible": true
          }
        ]
      },
      {
        "completed_at": "2026-08-30T09:00:02Z",
        "duration_ms": 1000,
        "engine_version": "1.0.0",
        "input_ref": {
          "rows": 324,
          "series": 12,
          "sha256": "2c3f17d545a4b6f1f32d33b9978bd3649093bec230220986fdb4416ddac6d727",
          "type": "normalised_dataset"
        },
        "options": {
          "as_of_date": "2026-08-01",
          "as_of_date_source": "user_supplied",
          "grain": "month",
          "grain_evidence": {
            "method": "modal_spacing",
            "minority": {},
            "series_agree": 12,
            "series_total": 12
          },
          "thresholds": {
            "coverage_not_usable_pct": 50,
            "cv_squared_estimator": "population",
            "cv_squared_min_nonzero_observations": 3,
            "extract_stale_trailing_periods": 2,
            "gap_block_concentration_ratio": 0.8,
            "gap_block_min_run": 3,
            "history_not_usable_periods": 6,
            "history_short_periods": 18,
            "level_shift_min_run": 3,
            "level_shift_pack_factor_tolerance_pct": 12,
            "long_tail_cumulative_pct": 99,
            "outlier_deseasonalise_min_periods": 24,
            "outlier_modified_z": 3.5,
            "portfolio_caveated_volume_pct": 5,
            "portfolio_not_usable_volume_pct": 20,
            "series_discontinued_trailing_periods": 6,
            "series_stale_trailing_periods": 3,
            "sparse_coverage_pct": 70,
            "suspect_zero_max_adi": 1.25,
            "suspect_zero_max_zero_share_pct": 10,
            "volume_immaterial_share_pct": 0.1
          },
          "weighting": "volume"
        },
        "outcome": {
          "band": "caveated",
          "finding_codes": [
            "LONG_TAIL_CONCENTRATION"
          ],
          "flagged_series": 8,
          "series": 12
        },
        "output_ref": {
          "series": 12,
          "sha256": "e025fbed00fc10b07aa9cbe30a804270a9f73e7b3d8287b074ff5f5c4ab063b6",
          "type": "quality_result"
        },
        "stage": "quality",
        "started_at": "2026-08-30T09:00:01Z",
        "story": "1.2"
      },
      {
        "completed_at": "2026-08-30T09:00:03Z",
        "duration_ms": 1000,
        "engine_version": "1.0.0",
        "input_ref": {
          "series": 12,
          "sha256": "e025fbed00fc10b07aa9cbe30a804270a9f73e7b3d8287b074ff5f5c4ab063b6",
          "type": "quality_result"
        },
        "options": {
          "abc_a_cumulative_pct": 80,
          "abc_b_cumulative_pct": 95,
          "abc_basis": "volume",
          "abc_basis_note": "ABC uses cumulative demand volume because unit cost is not available until story 4.1.",
          "adi_cut": 1.32,
          "cv_squared_basis": "non_zero_periods_only",
          "cv_squared_cut": 0.49,
          "cv_squared_estimator": "population",
          "cv_squared_estimator_note": "Population variance divides by n and uses non-zero periods only.",
          "cv_squared_min_nonzero_observations": 3,
          "xyz_basis": "cv_all_periods",
          "xyz_min_periods_present": 3,
          "xyz_x_max_cv": 0.5,
          "xyz_y_max_cv": 1
        },
        "outcome": {
          "abc_counts": {
            "A": 2,
            "B": 3,
            "C": 7
          },
          "class_counts": {
            "erratic": 1,
            "intermittent": 1,
            "lumpy": 0,
            "smooth": 10,
            "unclassifiable": 0
          },
          "matrix_cell_occupancy": {
            "A/erratic": 0,
            "A/intermittent": 0,
            "A/lumpy": 0,
            "A/smooth": 2,
            "A/unclassifiable": 0,
            "B/erratic": 0,
            "B/intermittent": 0,
            "B/lumpy": 0,
            "B/smooth": 3,
            "B/unclassifiable": 0,
            "C/erratic": 1,
            "C/intermittent": 1,
            "C/lumpy": 0,
            "C/smooth": 5,
            "C/unclassifiable": 0
          },
          "xyz_meaningful_count": 11
        },
        "output_ref": {
          "series": 12,
          "sha256": "51de88da2b59b1c3134ab362a71cc9a9a38d6540732c54d8170a02576fdc1983",
          "type": "classification_result"
        },
        "stage": "classification",
        "started_at": "2026-08-30T09:00:02Z",
        "story": "2.1"
      },
      {
        "completed_at": "2026-08-30T09:00:04Z",
        "duration_ms": 1000,
        "engine_version": "1.1.0",
        "input_ref": {
          "series": 12,
          "sha256": "51de88da2b59b1c3134ab362a71cc9a9a38d6540732c54d8170a02576fdc1983",
          "type": "classification_result"
        },
        "options": {
          "passes": [
            {
              "pass": 1,
              "resolutions_applied": 0
            }
          ],
          "precedence": [
            "1. A line carrying SERIES_DISCONTINUED routes to discontinued_confirm_status, whatever its class and whatever its band.",
            "2. Otherwise a not_usable band routes to refused_data_quality, whatever its class.",
            "3. Otherwise the demand class decides, including unclassifiable to insufficient_evidence."
          ],
          "resolution_vocabulary": {
            "DISCONTINUED": [
              "DISCONTINUED_CONFIRMED",
              "SUPERSEDED_BY_SKU",
              "STILL_ACTIVE_DEMAND_GAP",
              "STILL_ACTIVE_DATA_MISSING",
              "DEFER"
            ],
            "INSUFFICIENT_EVIDENCE": [
              "SUPPLY_LONGER_HISTORY",
              "TREAT_AS_NEW_LINE",
              "EXCLUDE_FROM_SCOPE",
              "DEFER"
            ],
            "REFUSED_DATA_QUALITY": [
              "SUPPLY_LONGER_HISTORY",
              "SUPPLY_CORRECTED_EXTRACT",
              "TREAT_AS_NEW_LINE",
              "EXCLUDE_FROM_SCOPE",
              "DEFER"
            ]
          },
          "resolutions_supplied": {
            "by_code": {},
            "count": 0
          },
          "routing_table_version": "1.2"
        },
        "outcome": {
          "data_requested_count": 0,
          "decision_counts": {
            "discontinued_confirm_status": 1,
            "insufficient_evidence": 0,
            "intermittent_methods": 1,
            "model_eligible": 7,
            "model_eligible_wide_interval": 1,
            "policy_only": 0,
            "refused_data_quality": 2
          },
          "deferred_count": 0,
          "eligible_count": 9,
          "ineligible_count": 3,
          "open_item_count": 3,
          "out_of_scope_count": 0,